{
  "backendArtifacts": [
    {
      "backendId": "web-css-vars",
      "file": "tokens.css",
      "kind": "primaryTokenOutput",
      "sha256": "sha256:587346dca4fbf32258eb415211aff244a2fcfb4ea15421582947cd1abebde7d7",
      "size": 2175
    },
    {
      "backendId": "web-css-vars",
      "file": "components.css",
      "kind": "systemStylesheet",
      "sha256": "sha256:3d30bbce79b728aed45e5bb347be171c88d3079ac01dc92cdf218214fe55c3a3",
      "size": 448
    },
    {
      "backendId": "web-css-vars",
      "file": "tokens.vars.css",
      "kind": "tokenStylesheet",
      "sha256": "sha256:b191c3bdac386a3713bf2c325065193e9561dd4a9b4711de0f1ff5900fc89b29",
      "size": 1726
    },
    {
      "backendId": "web-css-vars",
      "file": "tokens.d.ts",
      "kind": "typeDeclarations",
      "sha256": "sha256:5caed2cb43d679d0837864866c7a243d735bb07baae949bf9a865694aafeefaf",
      "size": 387
    }
  ],
  "projectionKind": "editorDiagnostics",
  "projectionVersion": 1,
  "records": [],
  "reportKind": "pack",
  "sourceReport": {
    "file": "validation.json"
  },
  "summary": {
    "clean": true,
    "families": [],
    "severities": [],
    "total": 0
  }
}